{
  "ccis_object": "ccis.event",
  "schema_version": 1,
  "event_id": "evt_task_ccis_contracts_000004",
  "sequence": 4,
  "recorded_at": "2026-08-03T08:13:00Z",
  "task_id": "task_ccis_contracts",
  "event_type": "ccis.transition.accepted",
  "transition_id": "transition_contracts_gated_accepted",
  "previous_event_hash": "sha256:5555555555555555555555555555555555555555555555555555555555555555",
  "payload_hash": "sha256:6666666666666666666666666666666666666666666666666666666666666666",
  "event_hash": "sha256:7777777777777777777777777777777777777777777777777777777777777777",
  "payload": {"from_state": "GATED", "to_state": "ACCEPTED", "outcome": "ACCEPTED"},
  "evidence_refs": ["evidence://task_ccis_contracts/transition_contracts_gated_accepted"]
}
